codigo,descripcion,merma,precio_unidad,proveedor_precio,formato_compra,precio_original,unidad_original,fecha_precio,url_precio,observaciones_precio
ING-0709,ACEITE DE COCO 1L,0.0,,PENDIENTE,,,,2026-06-13,,Duplicado: aceite de coco ya tratado en lote01.
ING-0710,ACEITE DE TRUFA 250 ML,0.0,,PENDIENTE,,,,2026-06-13,,Duplicado: aceite de trufa ya tratado en lote01.
ING-0711,ACEITE GIRASOL,0.0,,PENDIENTE,,,,2026-06-13,,Duplicado: aceite girasol ya tratado en lote01.
ING-0712,ACEITE NUEZ,0.0,,PENDIENTE,,,,2026-06-13,,Aceite de nuez sigue pendiente; no localizado precio oficial claro.
ING-0713,ACEITE OLIVA 0.4 1l,0.0,,PENDIENTE,,,,2026-06-13,,"Duplicado: aceite oliva 0,4 ya tratado en lote01."
ING-0714,ACEITE OLIVA INTENSO,0.0,,PENDIENTE,,,,2026-06-13,,Duplicado: aceite oliva intenso ya tratado en lote01.
ING-0715,ACEITE OLIVA MONODOSIS 10MLX144U,0.0,,PENDIENTE,,,,2026-06-13,,Duplicado: aceite oliva monodosis ya tratado en lote01.
ING-0716,ACEITE SESAMO BLUE DRAGON 150ML,0.0,,PENDIENTE,,,,2026-06-13,,Duplicado: aceite sésamo ya tratado en lote01.
ING-0915,AGUA 33CL PLASTICO MAKRO pak 35,0.0,0.3097,MAKRO,Cabreiroa agua PET 33 cl x 35 unidades,10.84,35 botellas x 33 cl,2026-06-13,https://tienda.makro.es/shop/pv/BTY-X646636/0032/0021/Cabreiroa-agua-pet-33cl-contiene-35-unidades,Precio con IVA/IGIC incluido. Normalizado a €/botella de 33 cl.
ING-0916,AGUA 5 L GARRAFA MAKRO,0.0,0.144,MAKRO,ARO agua garrafa 5 L,0.72,5 L,2026-06-13,https://tienda.makro.es/shop/pv/BTY-X206293/0034/0021/Aro-agua-garrafa-5-L,Precio con IVA/IGIC incluido. Normalizado a €/L.
ING-0522,AGUA DE AZAHAR 1L,0.0,,PENDIENTE,,,,2026-06-13,,"Agua de azahar: pastelería/aromas; reservar para lote08/lote12, no bebidas."
ING-0917,AGUA GAS VICHY 12 X 1L,0.0,1.3192,MAKRO,Vichy Catalan agua con gas botella 1 L x 12 unidades,15.83,12 botellas x 1 L,2026-06-13,https://tienda.makro.es/shop/store/pv/BTY-X378121/0032/0021/VICHY-CATALAN-agua-con-gas-botella-1-L-contiene-12-unidades,Precio con IVA/IGIC incluido. Normalizado a €/botella de 1 L.
ING-0914,"AGUA PET SOLAN DE CABRAS 0,5 L X 20 UD",0.0,0.6705,MAKRO,Solán de Cabras agua PET 50 cl x 20 unidades,13.41,20 botellas x 50 cl,2026-06-13,https://tienda.makro.es/shop/pv/BTY-X112328/0032/0021/SOL%C3%81N-DE-CABRAS-agua-pet-50cl-contiene-20-unidades,Precio con IVA/IGIC incluido. Normalizado a €/botella de 50 cl.
ING-0913,"AGUA PET SOLAN DE CABRAS 1,5 L X 6 UD",0.0,0.7367,MAKRO,"Solán de Cabras agua PET 1,5 L x 6 unidades",4.42,"6 botellas x 1,5 L",2026-06-13,https://tienda.makro.es/ordercapture/uidispatcher/static/shop/pv/BTY-X709621/0033/0021/SOL%C3%81N-DE-CABRAS-agua-pet-1-5L-contiene-6-unidades,"Precio con IVA/IGIC incluido. Normalizado a €/botella de 1,5 L."
ING-0466,AGUACATE 1K,0.0,,PENDIENTE,,,,2026-06-13,,Duplicado/fuera de lote: aguacate tratado en lote06 frutas.
ING-0449,AGUACATE A DADOS 1K,0.0,,PENDIENTE,,,,2026-06-13,,Duplicado/fuera de lote: aguacate dados tratado en lote06 frutas.
ING-0282,AJETE CHINO/cebolla tierna china,0.0,,PENDIENTE,,,,2026-06-13,,Duplicado/fuera de lote: ajete chino tratado en lote01/lote05.
ING-0724,ALCAPARRON 360G,0.0,,PENDIENTE,,,,2026-06-13,,Alcaparrón: conserva/encurtido del lote09; no actualizar aquí.
ING-0525,ALMENDRA ENTERA REPELEDA,0.0,,PENDIENTE,,,,2026-06-13,,Duplicado/fuera de lote: almendra repelada ya tratada en lote01/lote08.
ING-0526,ALMENDRA FILETEADA 1K,0.0,,PENDIENTE,,,,2026-06-13,,Fuera de lote: almendra fileteada corresponde a pastelería/frutos secos.
ING-0918,AMARETO,0.0,21.6143,MAKRO,DISARONNO licor amaretto botella 70 cl,15.13,70 cl,2026-06-13,https://tienda.makro.es/shop/pv/BTY-X872446/0032/0021/DISARONNO-licor-amaretto-70cl,Precio con IVA/IGIC incluido. Normalizado a €/L.
ING-0919,ANIS DULCE la castellana,0.0,9.8286,MAKRO,La Castellana anís dulce botella 70 cl,6.88,70 cl,2026-06-13,https://tienda.makro.es/shop/pv/BTY-X151332/0032/0021/La-Castellana-an%C3%ADs-dulce-botella-70cl,Precio con IVA/IGIC incluido. Normalizado a €/L.
ING-0920,ANIS SECO,0.0,14.27,MAKRO,Chinchón de la Alcoholera anís seco botella 1 L,14.27,1 L,2026-06-13,https://tienda.makro.es/shop/pv/BTY-X62858/0032/0021/CHINCHON-DE-LA-ALCOHOLERA-anis-seco-1L,Precio con IVA/IGIC incluido. €/L.
ING-0921,ARMAGNAC,0.0,36.8,MAKRO,Saint Vivant armagnac botella 70 cl,25.76,70 cl,2026-06-13,https://tienda.makro.es/shop/pv/BTY-X211620/0032/0021/Saint-Vivant-armagnac-botella-70cl,Precio con IVA/IGIC incluido. Normalizado a €/L.
ING-0738,ARROZ INTEGRAL BOLSA 1KG,0.0,,PENDIENTE,,,,2026-06-13,,Duplicado: arroz integral tratado en lote02.
ING-0742,ATUN ACEITE VEGET. ARO 650,0.0,,PENDIENTE,,,,2026-06-13,,Duplicado/fuera de lote: atún aceite vegetal tratado en lote04.
ING-0743,AZAFRAN HEBRA POTE 4SB 100MG,0.0,,PENDIENTE,,,,2026-06-13,,Duplicado/fuera de lote: azafrán tratado en lote09.
ING-0923,AZUCAR MORENO SOBRES 500 UNI,0.0,,PENDIENTE,,,,2026-06-13,,Duplicado: azúcar moreno sobres tratado en lote02.
ING-0922,AZUCAR SOBRES 1000 UNI,0.0,,PENDIENTE,,,,2026-06-13,,Duplicado: azúcar sobres tratado en lote02.
ING-0031,BABILLA entera,0.0,,PENDIENTE,,,,2026-06-13,,Fuera de lote: carne/vacuno. No actualizar en bebidas.
ING-0259,BACALAO marinado AHUMADO EN ACEITE mercadona 110 G,0.0,,PENDIENTE,,,,2026-06-13,,Fuera de lote: pescado/marisco. No actualizar en bebidas.
ING-0924,BAILEYS IRISH CREAM,0.0,11.5,MAKRO,BAILEYS licor crema botella 1 L,11.5,1 L,2026-06-13,https://tienda.makro.es/shop/category/alimentaci%C3%B3n-general/bebidas/espirituosos/cremas-de-licor,Precio con IVA/IGIC incluido. €/L.
ING-0925,BITTER ANGOSTURA 20CL,0.0,72.9,MAKRO,ANGOSTURA Bitters botella 20 cl,14.58,20 cl,2026-06-13,https://tienda.makro.es/shop/store/pv/BTY-X5544/0032/0021/Angostura-Bitters-botella-20cl,Precio con IVA/IGIC incluido. Normalizado a €/L.
ING-0209,BOGAVANTE CRUDO 350/400 5K 12 PZ,0.0,,PENDIENTE,,,,2026-06-13,,Fuera de lote: pescado/marisco tratado en lote04.
ING-0210,BOGAVANTE CRUDO 375G,0.0,,PENDIENTE,,,,2026-06-13,,Fuera de lote: pescado/marisco tratado en lote04.
ING-0151,"BOGAVANTE FRESCO 0,4-0,6 USA",0.0,,PENDIENTE,,,,2026-06-13,,Fuera de lote: pescado/marisco tratado en lote04.
ING-0450,BOLETUS ENTEROS CONGELADOS 750G,0.0,,PENDIENTE,,,,2026-06-13,,Fuera de lote: boletus tratado en lote05 verduras.
ING-0152,BONITO DEL NORTE 3K,0.0,,PENDIENTE,,,,2026-06-13,,Fuera de lote: pescado/marisco tratado en lote04.
ING-0153,BOQUERON grande mediterraneo,0.0,,PENDIENTE,,,,2026-06-13,,Fuera de lote: pescado/marisco tratado en lote04.
ING-0927,BRANDY CARDENAL MENDOZA,0.0,29.5429,MAKRO,Cardenal Mendoza brandy botella 70 cl,20.68,70 cl,2026-06-13,https://tienda.makro.es/shop/pv/BTY-X76053/0032/0021/Cardenal-Mendoza-brandy-botella-70cl,Precio con IVA/IGIC incluido. Normalizado a €/L.
ING-0926,BRANDY DON PABLO cocina,0.0,,PENDIENTE,,,,2026-06-13,,Brandy Don Pablo cocina: no localizado precio oficial claro. No sustituyo por brandy genérico sin confirmación.
ING-0928,BRANDY MASCARÓ,0.0,,PENDIENTE,,,,2026-06-13,,Brandy Mascaró: no localizado precio oficial claro en fuentes objetivo.
ING-0929,BRANDY SOLERA MAGNO,0.0,18.26,MAKRO,Magno brandy botella 1 L,18.26,1 L,2026-06-13,https://tienda.makro.es/shop/pv/BTY-X186504/0032/0021/Magno-brandy-botella-1L,Precio con IVA/IGIC incluido. €/L.
ING-0303,"BROTES SAKURA MIX 1,6KG makro",0.0,,PENDIENTE,,,,2026-06-13,,Fuera de lote: brotes sakura/verduras.
ING-0155,CABALLA DEL NORTE,0.0,,PENDIENTE,,,,2026-06-13,,Fuera de lote: pescado/marisco.
ING-0744,CACAHUETE FRITO 1K,0.0,,PENDIENTE,,,,2026-06-13,,Duplicado/fuera de lote: cacahuete tratado en lote09.
ING-0548,CACAHUETE REPELADO crudo,0.0,,PENDIENTE,,,,2026-06-13,,Fuera de lote: cacahuete corresponde a lote08 pastelería/frutos secos.
ING-0032,CADERA entera,0.0,,PENDIENTE,,,,2026-06-13,,Fuera de lote: carne/vacuno. No actualizar en bebidas.
ING-0932,CAFÉ GRANO DESCAFEINADO MAKRO NORMAL,0.0,9.78,MAKRO,ARO café grano descafeinado 1 kg,9.78,1 kg,2026-06-13,https://tienda.makro.es/shop/pv/BTY-X178489/0032/0021/aro-caf%C3%A9-grano-descafeinado-1KG,Producto equivalente normal. Precio con IVA/IGIC incluido. €/kg.
ING-0930,CAFÉ GRANO DESCAFEINADO RIOBA SUPERIOR,0.0,20.15,MAKRO,RIOBA café en grano descafeinado natural gran selección 1 kg,20.15,1 kg,2026-06-13,https://tienda.makro.es/shop/pv/BTY-X221147/0032/0021/RIOBA-caf%C3%A9-en-grano-descafeinado-natural-gran-selecci%C3%B3n-1Kg,Precio con IVA/IGIC incluido según categoría/ficha. €/kg.
ING-0933,CAFÉ GRANO NATURAL MAKRO NORMAL,0.0,9.78,MAKRO,ARO café en grano natural 1 kg,9.78,1 kg,2026-06-13,https://tienda.makro.es/shop/pv/BTY-X207655/0033/0021/aro-caf%C3%A9-en-grano-natural-1-Kg,Precio con IVA/IGIC incluido. €/kg.
ING-0931,CAFÉ GRANO NATURAL RIOBA SUPERIOR,0.0,20.15,MAKRO,RIOBA café en grano natural gran selección 1 kg,20.15,1 kg,2026-06-13,https://tienda.makro.es/ordercapture/uidispatcher/static/shop/pv/BTY-X69815/0032/0021/RIOBA-caf%C3%A9-en-grano-natural-gran-selecci%C3%B3n-1Kg,Producto equivalente a Rioba superior. Precio con IVA/IGIC incluido según resultado Makro. €/kg.
ING-0934,CAFÉ MOLIDO DESCAFEINADO 500G(100sobres),0.0,0.1517,MAKRO,NESCAFÉ Classic café soluble descafeinado 100 sobres x 2 g,15.17,100 sobres,2026-06-13,https://tienda.makro.es/shop/pv/BTY-X174580/0032/0021/NESCAFE-CLASSIC-Caf%C3%A9-soluble-descafeinado-100-estuches-de-2-g,Equivalente a café descafeinado en sobres. Normalizado a €/sobre.
ING-0935,CAFÉ SOLUBLE,0.0,22.5,MAKRO,RIOBA café soluble natural 200 g,4.5,200 g,2026-06-13,https://tienda.makro.es/shop/category/alimentaci%C3%B3n-general/despensa/caf%C3%A9/caf%C3%A9-soluble,"Precio categoría Makro: 4,09 € neto / 4,50 € IVA incl. aprox. Normalizado a €/kg."
ING-0936,CAFÉ SOLUBLE DESCAFEINADO,0.0,23.6,MAKRO,RIOBA café soluble descafeinado 200 g,4.72,200 g,2026-06-13,https://tienda.makro.es/shop/pv/BTY-X119674/0032/0021/RIOBA-caf%C3%A9-soluble-descafeinado-200g,Precio con IVA/IGIC incluido. Normalizado a €/kg.
ING-0937,CAMPARI,0.0,14.87,MAKRO,Campari aperitivo botella 1 L,14.87,1 L,2026-06-13,https://tienda.makro.es/shop/pv/BTY-X302214/0032/0021/CAMPARI-aperitivo-botella-1l,Precio con IVA/IGIC incluido. €/L.
ING-0033,CANAL MEDIA TERNERA,0.0,,PENDIENTE,,,,2026-06-13,,Fuera de lote: carne/vacuno. No actualizar en bebidas.
ING-0554,CANELA RAMA 150 G bote,0.0,,PENDIENTE,,,,2026-06-13,,Fuera de lote: canela corresponde a lote08/lote09.
ING-0308,CANONIGOS 100 G sh levante,0.0,,PENDIENTE,,,,2026-06-13,,Fuera de lote: canónigos corresponde a lote05 verduras.
ING-0034,CARRILLADA TERNERA,0.0,,PENDIENTE,,,,2026-06-13,,Fuera de lote: carne/vacuno. No actualizar en bebidas.
ING-0938,CAVA BRUT cocina,0.0,,PENDIENTE,,,,2026-06-13,,Cava brut cocina: no localizado equivalente económico claro con precio oficial. Mejor revisar proveedor exacto.
ING-0748,CEBOLLA FRITA CRUJIENTE 1 kG,0.0,,PENDIENTE,,,,2026-06-13,,Duplicado/fuera de lote: cebolla frita crujiente tratada en lote09.
ING-0944,CERVEZA ESTRELA GALICIA LATA 33cl x 24,0.0,0.6146,MAKRO,Estrella Galicia cerveza 33 cl x 24 latas,14.75,24 latas x 33 cl,2026-06-13,https://tienda.makro.es/shop/pv/BTY-X637224/0032/0021/Estrella-Galicia-cerveza-33cl-contiene-24-latas,Precio con IVA/IGIC incluido. Normalizado a €/lata.
ING-0939,CERVEZA ESTRELLA GALICIA 33cl cristal 24u,0.0,0.9675,MAKRO,Estrella Galicia cerveza 33 cl x 24 botellas,23.22,24 botellas x 33 cl,2026-06-13,https://tienda.makro.es/shop/pv/BTY-X101734/0032/0021/Estrella-Galicia-cerveza-33cl-contiene-24-botellas,Precio con IVA/IGIC incluido. Normalizado a €/botella.
ING-0940,CERVEZA NEGRA 33 cl x 4,0.0,0.945,MAKRO,1906 Red Vintage cerveza 33 cl x 6 botellas,5.67,6 botellas x 33 cl,2026-06-13,https://tienda.makro.es/shop/pv/BTY-X145918/0032/0021/1906-cerveza-red-vintage-botella-33cl-x6,Equivalente a cerveza negra/tostada. Precio con IVA/IGIC incluido. Normalizado a €/botella.
ING-0941,CERVEZA RUBIA LITRO,0.0,1.4817,MAKRO,Mahou cerveza clásica 1 L x 6 botellas,8.89,6 botellas x 1 L,2026-06-13,https://tienda.makro.es/shop/pv/BTY-X358894/0032/0021/Mahou-cerveza-Cl%C3%A1sica-1L-contiene-6-botellas,Precio con IVA/IGIC incluido. Normalizado a €/botella de 1 L.
ING-0942,CERVEZA SIN ALCOHOL ESTRELLA GALICIA33cl x 24U,0.0,0.4033,MAKRO,"Estrella Galicia cerveza 0,0 25 cl x 24 botellas",9.68,24 botellas x 25 cl,2026-06-13,https://tienda.makro.es/shop/pv/BTY-X115024/0032/0021/Estrella-Galicia-cerveza-0-0-25cl-contiene-24-botellas,"Producto equivalente: 25 cl, no 33 cl. Normalizado a €/botella."
ING-0943,CERVEZA TURIA 25CL X24,0.0,0.4363,MAKRO,Estrella Galicia cerveza 25 cl x 24 botellas,10.47,24 botellas x 25 cl,2026-06-13,https://tienda.makro.es/shop/category/alimentaci%C3%B3n-general/bebidas/cervezas/cerveza-rubia,Equivalente a botella 25 cl; no Turia. Precio con IVA/IGIC incluido. Normalizado a €/botella. Revisar marca antes del MASTER.
ING-0559,CHOCOLATE/COBERTURA BLANCO SIN AZUCAR,0.0,,PENDIENTE,,,,2026-06-13,,"Fuera de lote: cobertura chocolate, reservar para lote08."
ING-0072,CHULETERO LOMO ENTERO CON SOLOMILLO +/-10K,0.0,,PENDIENTE,,,,2026-06-13,,Fuera de lote: carne/cerdo tratado en lote03.
ING-0322,CITRONELA LEMON-GRAS 300G,0.0,,PENDIENTE,,,,2026-06-13,,Fuera de lote: citronela/lemon grass corresponde a verduras/aromáticos.
ING-0561,CLARA PASTEURIZADA,0.0,,PENDIENTE,,,,2026-06-13,,Duplicado/fuera de lote: clara pasteurizada tratada en lote07.
ING-0945,COCA COLA 0% 24 CRISTAL 35CL,0.0,0.7738,MAKRO,Coca-Cola Zero azúcar lata 33 cl x 24 unidades,18.57,24 latas x 33 cl,2026-06-13,https://tienda.makro.es/shop/pv/BTY-X173747/0032/0021/Coca-Cola-zero-lata-33cl-contiene-24-unidades,No se localiza cristal 35 cl; uso lata 33 cl como equivalente. Revisar antes del MASTER.
ING-0947,COCA COLA 0% LATA 33 clx 24,0.0,0.7738,MAKRO,Coca-Cola Zero azúcar lata 33 cl x 24 unidades,18.57,24 latas x 33 cl,2026-06-13,https://tienda.makro.es/shop/pv/BTY-X173747/0032/0021/Coca-Cola-zero-lata-33cl-contiene-24-unidades,Precio con IVA/IGIC incluido. Normalizado a €/lata.
ING-0946,COCA COLA LATA,0.0,,PENDIENTE,,,,2026-06-13,,Coca-Cola lata aparece sin detalle de pack en inventario; actualizo el pack estándar con el código ING-0948/0947 si se confirma.
ING-0948,COCACOLA cristal 35cl 24u,0.0,0.7738,MAKRO,Coca-Cola sabor original lata 33 cl x 24 unidades,18.57,24 latas x 33 cl,2026-06-13,https://tienda.makro.es/shop/pv/BTY-X55721/0033/0021/COCA-COLA-sabor-original-en-lata-33-cl-en-pack-contiene-24-latas,No se localiza cristal 35 cl; uso lata 33 cl como equivalente. Revisar antes del MASTER.
ING-0077,CODILLO FRESCO ENTERO carnisseria sonia,0.0,,PENDIENTE,,,,2026-06-13,,Fuera de lote: codillo fresco corresponde a carnes.
ING-0951,COGNAC COURVOSIER,0.0,69.3,MAKRO,Courvoisier VSOP cognac botella 70 cl,48.51,70 cl,2026-06-13,https://tienda.makro.es/shop/store/pv/BTY-X76989/0032/0021/Courvoisier-Vsop-cognac-botella-70cl,Precio con IVA/IGIC incluido. Normalizado a €/L.
ING-0949,COINTREAU,0.0,25.9143,MAKRO,COINTREAU licor botella 70 cl,18.14,70 cl,2026-06-13,https://tienda.makro.es/shop/pv/BTY-X805145/0032/0021/Cointreau-licor-botella-70cl,Precio con IVA/IGIC incluido. Normalizado a €/L.
ING-0950,COINTREAU PASTELERÍA,0.0,25.9143,MAKRO,COINTREAU licor botella 70 cl,18.14,70 cl,2026-06-13,https://tienda.makro.es/shop/pv/BTY-X805145/0032/0021/Cointreau-licor-botella-70cl,Mismo producto usado para pastelería. Precio con IVA/IGIC incluido. Normalizado a €/L.
ING-0568,COLORANTE Amarillo huevo PASTA 200G,0.0,,PENDIENTE,,,,2026-06-13,,"Fuera de lote: colorante de pastelería/decoración, lote08/lote12."
ING-0569,COLORANTE BLANCO PASTA COSMO,0.0,,PENDIENTE,,,,2026-06-13,,"Fuera de lote: colorante de pastelería/decoración, lote08/lote12."
ING-0570,COLORANTE MARRON PASTA 200G,0.0,,PENDIENTE,,,,2026-06-13,,"Fuera de lote: colorante de pastelería/decoración, lote08/lote12."
ING-0571,COLORANTE NARANJA PASTA 200 G,0.0,,PENDIENTE,,,,2026-06-13,,"Fuera de lote: colorante de pastelería/decoración, lote08/lote12."
ING-0572,COLORANTE NEGRO PASTA 200 G,0.0,,PENDIENTE,,,,2026-06-13,,"Fuera de lote: colorante de pastelería/decoración, lote08/lote12."
ING-0573,COLORANTE ROJO PASTA 200G,0.0,,PENDIENTE,,,,2026-06-13,,"Fuera de lote: colorante de pastelería/decoración, lote08/lote12."
ING-0574,COLORANTE VERDE PASTA 200G,0.0,,PENDIENTE,,,,2026-06-13,,"Fuera de lote: colorante de pastelería/decoración, lote08/lote12."
ING-0575,COLORANTE VIOLETA PASTA (AZUL),0.0,,PENDIENTE,,,,2026-06-13,,"Fuera de lote: colorante de pastelería/decoración, lote08/lote12."
ING-0576,COLORANTEAMARILLO LIMÓN PASTA 200g,0.0,,PENDIENTE,,,,2026-06-13,,"Fuera de lote: colorante de pastelería/decoración, lote08/lote12."
ING-0037,COSTILLA ENTERA,0.0,,PENDIENTE,,,,2026-06-13,,Fuera de lote: carne/cerdo tratado en lote03.
ING-0083,COSTILLAR CORTE FOSTER,0.0,,PENDIENTE,,,,2026-06-13,,Fuera de lote: carne/cerdo tratado en lote03.
ING-0752,CREMA CACAHUETE C MANI SUAVE 510G,0.0,,PENDIENTE,,,,2026-06-13,,Duplicado/fuera de lote: crema de cacahuete tratada en lote07/lote09.
ING-0333,DIENTE DE LEON,0.0,,PENDIENTE,,,,2026-06-13,,Fuera de lote: diente de león corresponde a verduras/aromáticos.
ING-0952,DRAMBUIE licor whisky,0.0,37.2571,MAKRO,DRAMBUIE licor whisky botella 70 cl,26.08,70 cl,2026-06-13,https://tienda.makro.es/shop/pv/BTY-X61638/0032/0021/DRAMBUIE-licor-whisky-botella-70cl,Precio con IVA/IGIC incluido. Normalizado a €/L.
ING-0953,EDULCORANTE1GR 500 UNID,0.0,0.0151,MAKRO,"RIOBA edulcorante monodosis 150 uds x 0,8 g",2.26,150 sobres,2026-06-13,https://tienda.makro.es/shop/category/alimentaci%C3%B3n-general/despensa/az%C3%BAcar-y-edulcorante/edulcorante,Equivalente monodosis; el inventario indica 500 uds. Normalizado a €/sobre.
ING-0765,ESPECIAS COLORANTE ALIMENTARIO,0.0,,PENDIENTE,,,,2026-06-13,,Duplicado/fuera de lote: colorante alimentario/especia tratado en lote09.
ING-0775,ESPECIAS PIMIENTA NEGRA ENTERA 500 G,0.0,,PENDIENTE,,,,2026-06-13,,Duplicado/fuera de lote: pimienta negra entera tratada/pendiente en lote09.
ING-0341,ESPINACAS ENTERAS,0.0,,PENDIENTE,,,,2026-06-13,,Fuera de lote: espinacas corresponde a verduras.
ING-0783,ESTERILLA SUSHI,0.0,,PENDIENTE,,,,2026-06-13,,"Fuera de lote: esterilla sushi es utensilio/material, no ingrediente."
ING-0584,FIDEO CHOCOLATE 1K,,,PENDIENTE,,,,2026-06-13,,No procesado en este lote.
